{
  "edges": [],
  "nodes": {
    "human-paulo-studio": {
      "created_at": "2026-10-16T03:32:54.548240+00:00",
      "description": "Workspace principal do projeto Human Paulo Studio",
      "evidence": [],
      "id": "human-paulo-studio",
      "label": "Human Paulo Studio",
      "metadata": {
        "generator": "wm-scaffold"
      },
      "revision": 1,
      "scope": "workspace",
      "status": "active",
      "type": "workspace",
      "updated_at": "2026-10-16T03:32:54.548240+00:00"
    }
  },
  "revision": 1,
  "updated_at": "2026-10-16T03:32:54.548240+00:00",
  "version": "2.0.0"
}
